{
  "schemaVersion": 1,
  "workspaceId": "synthetic-workspace",
  "workspaceName": "Synthetic CAVE",
  "sourceMode": "Demo",
  "generatedAtUtc": "2026-09-27T12:00:00.0000000+00:00",
  "sourceUpdatedAtUtc": "2026-09-27T11:59:59Z",
  "sourceStatus": "Ready",
  "error": null,
  "totalAgentCount": 3,
  "agents": [
    {
      "agentId": "aaaaaaaaaaaaaaaaaaaaaaaaaaaaaaaaaaaaaaaaaaaaaaaaaaaaaaaaaaaaaaaa",
      "displayName": "Main agent",
      "agentType": "agent",
      "isSubagent": false,
      "state": "Active",
      "phase": "Working",
      "summary": "Validate JSON contract",
      "currentFocus": "Validate JSON contract",
      "focusEvidence": "Declared",
      "startedAtUtc": "2026-09-27T11:00:00Z",
      "updatedAtUtc": "2026-09-27T11:59:59Z",
      "evidence": "Observed",
      "summaryEvidence": "Declared"
    },
    {
      "agentId": "bbbbbbbbbbbbbbbbbbbbbbbbbbbbbbbbbbbbbbbbbbbbbbbbbbbbbbbbbbbbbbbb",
      "displayName": "Chlo\u00eb \ud83d\udd0e",
      "agentType": "reviewer",
      "isSubagent": true,
      "state": "Active",
      "phase": "Reading",
      "summary": "Reviewing Unicode \"escapes\"\n\tand / separators",
      "currentFocus": null,
      "focusEvidence": null,
      "startedAtUtc": "2026-09-27T11:30:00+02:00",
      "updatedAtUtc": "2026-09-27T11:59:58Z",
      "evidence": "Observed",
      "summaryEvidence": "Observed"
    },
    {
      "agentId": "cccccccccccccccccccccccccccccccccccccccccccccccccccccccccccccccc",
      "displayName": "Maya",
      "agentType": "tester",
      "isSubagent": true,
      "state": "Completed",
      "phase": null,
      "summary": "",
      "currentFocus": "",
      "focusEvidence": "Declared",
      "startedAtUtc": "2026-09-27T11:00:00Z",
      "updatedAtUtc": "2026-09-27T11:59:00Z",
      "evidence": "Declared",
      "summaryEvidence": "Declared"
    }
  ],
  "mainGoal": {
    "status": "Ready",
    "goal": {
      "objective": "Prove portable decoding without guessing native timestamp units",
      "isTruncated": false,
      "status": "Active",
      "tokenBudget": null,
      "tokensUsed": 0,
      "timeUsedSeconds": 0,
      "createdAt": -9223372036854775808,
      "updatedAt": 9223372036854775807
    },
    "retrievedAtUtc": "2026-09-27T12:00:00Z",
    "error": null
  }
}
